date,ticker,content,time_delta,pct_change
"July 17, 2020",PINS,"                GLOBAL MARKETS-Asia stocks rebound as hopes of more stimulus offset virus worries - ReutersDiscover Thomson ReutersFinancialGovernment SolutionsLegalReuters News AgencyRisk Management SolutionsTax & AccountingBlog: Answers OnInnovation @ Thomson ReutersDirectory of sitesLoginContactSupportBusinessMarketsWorldPoliticsTVMoreUnited States Bonds NewsJuly 17, 2020 /  6:28 AM / 5 days agoGLOBAL MARKETS-Asia stocks rebound as hopes of more stimulus offset virus worriesHideyuki Sano4 Min Read* Asian shares recoup some of previous day’s losses * European stock futures up slightly * Hopes of more U.S. fiscal spending suppress other concerns * Euro eyes EU summit amid hopes of recovery fund deal By Hideyuki Sano TOKYO, July 17 (Reuters) - Asian shares eked out gains and U.S. stock futures bounced back on Friday as hopes of more government spending around the globe  outweighed concerns about rising coronavirus infections and worsening tensions between Washington and Beijing. European shares were also expected to rise, with pan-European Euro Stoxx 50 futures, German DAX futures , Britain’s FTSE futures all up 0.1-0.2%. U.S. stock futures rose 0.2%. MSCI’s broadest index of Asia-Pacific shares outside Japan advanced 0.4%, paring some of its 2% losses the previous day, while Nikkei slid 0.3% on concerns about rising virus infections in Tokyo. In China, the CSI300 index climbed 0.25%, clawing back some of Thursday’s 4.8% slide and shrugging off news that Washington is considering banning travel to the United States by all members of the Chinese Communist Party, which total more than 90 million. Market watchers said investors are counting on U.S. policymakers to adopt more stimulus measures as the world’s largest economy struggles to contain the epidemic, with some existing programmes to support businesses set to expire within weeks. The U.S. Congress is set to begin debating such a package next week, as several states in the country’s south and west implement fresh lockdown measures to curb the virus. “You would think such sharp rises in infections would normally lead to fall in stock prices but at the moment, that was being offset by strong hopes for vaccines,” said Tomo Kinoshita, global market strategist at Invesco in Tokyo. “But we now see higher risk of a market correction, considering the improvement in hard economic data we have seen over the past couple of months is likely to halt,” he said. While retail sales for June released on Thursday beat market expectations, real-time measures of retail foot traffic and employee working hours and shifts have flatlined after steady growth since April. The U.S. labour market remained in dire condition. There were 32 million people receiving unemployment checks under all programmes in the last week of June, down from the prior week but still the second-highest on record. Overnight the S&P500 dropped 0.34% as investors locked in gains from rallies in high-flying tech shares ahead of earnings later this month. Kicking off technology sector results, Netflix skidded 9.1% after the bell as the company posted slower subscriber growth than Wall Street’s high expectations and forecast a further slowdown in the pace of expansion in the current quarter. In currencies, the euro hovered below the four-week high it touched earlier this week, but stayed firm as European Union leaders meet on Friday to seek to overcome differences over a proposed stimulus package to kickstart economic growth stifled by the coronavirus. On the table at a summit starting later in the day - their first in-person talks around a table since the pandemic - are the EU’s 2021-27 budget and a new recovery fund worth 750 billion euros ($854 billion), which would mark a major step towards fiscal integration in Europe. While Dutch opposition and the threat of a Hungarian veto weigh on chances for a deal, investors are pinning hopes on it being a question of when, rather than if, a deal is struck. “Whether they will come to an agreement today, or by the end of this month, or by later this year is anybody’s guess. But there is a swell of hopes that you have seen at the start of the euro trading,” said Masaru Ishibashi, joint general manager of trading at Sumitomo Mitsui Bank. The euro fetched $1.1386, unchanged on the day. The yen was flat at 107.22 per dollar. In commodities trading, oil prices were little changed with Brent down 0.25% at $43.26 per barrel and U.S. crude down 0.15% at $40.87. $1 = 0.8783 eurosOur Standards:The Thomson Reuters Trust Principles.0 : 0narrow-browser-and-phonemedium-browser-and-portrait-tabletlandscape-tabletmedium-wide-browserwide-browser-and-largermedium-browser-and-landscape-tabletmedium-wide-browser-and-largerabove-phoneportrait-tablet-and-aboveabove-portrait-tabletlandscape-tablet-and-abovelandscape-tablet-and-medium-wide-browserportrait-tablet-and-belowlandscape-tablet-and-belowAppsNewslettersAdvertise with UsAdvertising GuidelinesCookiesTerms of UsePrivacyDo Not Sell My Personal InformationAll quotes delayed a minimum of 15 minutes. See here for a complete list of exchanges and delays.© 2020 Reuters. All Rights Reserved.",3,4.612914578631269
"July 17, 2020",PINS,"                German investigators' access to private data must be limited - court - ReutersDiscover Thomson ReutersFinancialGovernment SolutionsLegalReuters News AgencyRisk Management SolutionsTax & AccountingBlog: Answers OnInnovation @ Thomson ReutersDirectory of sitesLoginContactSupportBusinessMarketsWorldPoliticsTVMoreUnited States Internet of ThingsJuly 17, 2020 /  8:59 AM / 4 days agoGerman investigators' access to private data must be limited - court2 Min ReadKARLSRUHE, Germany, July 17 (Reuters) - A German federal court said on Friday that several laws giving investigators access to personal internet or phone data were unconstitutional and needed to be amended to better protect privacy. The court ruling is a victory for privacy activists who had said there were not sufficient limits on when and why federal police or domestic intelligence can access the names and addresses or even e-mail passwords and mobile phone PINs of users. One of the suits on which the ruling published on Friday is based was filed by Katharina Nocun and Patrick Breyer of the Pirate Party, along with around 6,000 joint plaintiffs, in 2013. They had said that Germany’s telecommunications law gave investigators sweeping access to users’ private data, risking the creation of “a new secret police of the internet that can ransack and scan our most intimate thoughts”. The court said on Friday that investigators can in principle be given access to the data of users, but that laws needed to balance how urgently such data was needed - to fend off imminent danger or solve crimes - with the protection of legal rights. Otherwise they encroach on users’ right to determine the use of their data as well as on telecommunications privacy. Neither the existing laws regulating under which circumstances telecoms companies such as Deutsche Telekom can hand over the data, nor the ones determining why investigators can request such data, are in line with Germany’s constitution, the court said. Legislators will now have time until the end of 2021 to amend the laws, the court said. Reporting by Ursula Knapp and Maria Sheahan;Editing by ElaineHardcastleOur Standards:The Thomson Reuters Trust Principles.0 : 0narrow-browser-and-phonemedium-browser-and-portrait-tabletlandscape-tabletmedium-wide-browserwide-browser-and-largermedium-browser-and-landscape-tabletmedium-wide-browser-and-largerabove-phoneportrait-tablet-and-aboveabove-portrait-tabletlandscape-tablet-and-abovelandscape-tablet-and-medium-wide-browserportrait-tablet-and-belowlandscape-tablet-and-belowAppsNewslettersAdvertise with UsAdvertising GuidelinesCookiesTerms of UsePrivacyDo Not Sell My Personal InformationAll quotes delayed a minimum of 15 minutes. See here for a complete list of exchanges and delays.© 2020 Reuters. All Rights Reserved.",3,4.612914578631269
"April 1, 2020",CGC,"                BRIEF-Canopy Growth Announces Changes To Its Board Of Directors - ReutersDiscover Thomson ReutersFinancialGovernment SolutionsLegalReuters News AgencyRisk Management SolutionsTax & AccountingBlog: Answers OnInnovation @ Thomson ReutersDirectory of sitesLoginContactSupportBusinessMarketsWorldPoliticsTVMoreUnited States HealthcareApril 1, 2020 /  11:07 AM / 4 months agoBRIEF-Canopy Growth Announces Changes To Its Board Of Directors1 Min ReadApril 1 (Reuters) - Canopy Growth Corp: * CANOPY GROWTH ANNOUNCES CHANGES TO ITS BOARD OF DIRECTORS * CANOPY GROWTH CORP - TERRY YANOFSKY AND DAVID LAZZARATO APPOINTED AS JOHN BELL AND PETER STRINGHAM RETIRE FROM CGC BOARD Source text for Eikon: Further company coverage:Our Standards:The Thomson Reuters Trust Principles.0 : 0narrow-browser-and-phonemedium-browser-and-portrait-tabletlandscape-tabletmedium-wide-browserwide-browser-and-largermedium-browser-and-landscape-tabletmedium-wide-browser-and-largerabove-phoneportrait-tablet-and-aboveabove-portrait-tabletlandscape-tablet-and-abovelandscape-tablet-and-medium-wide-browserportrait-tablet-and-belowlandscape-tablet-and-belowAppsNewslettersAdvertise with UsAdvertising GuidelinesCookiesTerms of UsePrivacyDo Not Sell My Personal InformationAll quotes delayed a minimum of 15 minutes. See here for a complete list of exchanges and delays.© 2020 Reuters. All Rights Reserved.",26,29.086898270478613
"June 22, 2020",CGC,"                Nokia to cut 1,233 jobs at French subsidiary Alcatel-Lucent - unions - ReutersDiscover Thomson ReutersFinancialGovernment SolutionsLegalReuters News AgencyRisk Management SolutionsTax & AccountingBlog: Answers OnInnovation @ Thomson ReutersDirectory of sitesLoginContactSupportBusinessMarketsWorldPoliticsTVMoreUnited States Company NewsJune 22, 2020 /  9:16 AM / a month agoNokia to cut 1,233 jobs at French subsidiary Alcatel-Lucent - unions1 Min ReadPARIS, June 22 (Reuters) - Finland’s Nokia Oyj plans to cut 1,233 jobs at its French subsidiary Alcatel-Lucent International, equivalent to a third of the local workforce, two union officials said on Monday. The maker of telecoms equipment informed French unions about the planned job cuts ahead of a works council in the morning. The CFE-CGC union published the job loss figure on its website. It was confirmed by Frederic Aussedat of the CFE-CGC union and Pascal Guihéneuf of the CFDT union. A spokeswoman for Nokia France declined to comment. Reporting by Mathieu Rosemain and Gwenalle Barzic; editing byRichard LoughOur Standards:The Thomson Reuters Trust Principles.0 : 0narrow-browser-and-phonemedium-browser-and-portrait-tabletlandscape-tabletmedium-wide-browserwide-browser-and-largermedium-browser-and-landscape-tabletmedium-wide-browser-and-largerabove-phoneportrait-tablet-and-aboveabove-portrait-tabletlandscape-tablet-and-abovelandscape-tablet-and-medium-wide-browserportrait-tablet-and-belowlandscape-tablet-and-belowAppsNewslettersAdvertise with UsAdvertising GuidelinesCookiesTerms of UsePrivacyDo Not Sell My Personal InformationAll quotes delayed a minimum of 15 minutes. See here for a complete list of exchanges and delays.© 2020 Reuters. All Rights Reserved.",23,4.490493618947339
"March 30, 2020",CGC,"                Airbus struggles to lift crisis-hit jet output - ReutersDiscover Thomson ReutersFinancialGovernment SolutionsLegalReuters News AgencyRisk Management SolutionsTax & AccountingBlog: Answers OnInnovation @ Thomson ReutersDirectory of sitesLoginContactSupportBusinessMarketsWorldPoliticsTVMoreUnited States Business NewsMarch 30, 2020 /  4:16 PM / 4 months agoAirbus struggles to lift crisis-hit jet outputTim Hepher, Johanna Decorse4 Min ReadPARIS/TOULOUSE (Reuters) - Europe’s Airbus (AIR.PA) is grappling with labor and supply chain shortages and may only be able to restore aircraft production to some 10-20% of normal levels for now because of partial shutdowns, industry and union sources said. FILE PHOTO: Airbus's annual press conference on Full-Year 2019 results in Blagnac near Toulouse, France, February 13, 2020.  REUTERS/Regis Duvignau/File PhotoWorst affected are wide-body jets, demand for which is expected to come under pressure as the coronavirus crisis hits  airlines worldwide, especially in the long-haul Asia market. The European planemaker, whose factories are spread across Europe, restored output at French and Spanish plants a week ago after a four-day shutdown. On Monday it announced a new closure of Spanish plants that make tail sections of Airbus jets. Airbus said it would suspend most production in Spain until April 9 after the Madrid government tightened the coronavirus lockdown. It has also said British and German wings production and assembly would stop for three weeks. On Monday, union officials estimated 10-12% of Airbus staff were present at Airbus headquarters factories in Toulouse. An industry official put the total closer to 15%. “Activity has restarted on the A320 line, and very weakly on the (wide-body) A350 and A330,” said Francoise Vallin, Airbus coordinator for the CFE-CGC union. Airbus reiterated it had withdrawn 2020 targets. STRATEGIC SECTOR Despite a massive effort by the French government to keep strategic parts of the economy running with credit guarantees and initiatives to protect small businesses, parts shortages persist throughout the supply chain, industry sources said. Especially badly hit are the so-called tier-two or tier-three suppliers, which are sub-contractors to larger companies that deal directly with Airbus or its U.S. rival Boeing. “Up to half the French supply chain has been closed at some point but the situation is improving,” a senior executive said.     Airbus and other major aerospace companies have been left in no doubt that the French government sees it as a strategically important sector and should not risk collapse of the supply chain by closing operations completely, two senior sources said. The immediate priority is to safeguard defense and security activities linked to public infrastructure, one of them added. “The idea is not to stop everything totally, because getting the sub-contractors and suppliers going again could be a very long process,” Vallin said. By contrast with the auto sector, suppliers are expected to pick up speed only gradually as airlines resume flying and amass the cash needed to fulfill record orders. Airlines last week predicted a slower U-shaped recovery rather than a V-shaped one. France’s Safran (SAF.PA), the world’s third largest aero supplier, said last week it continued to deliver engines to Airbus and had enough parts for 2-to-3 weeks. But its chief executive noted some problems further down its supply chain. Slideshow (2 Images)Airbus is also finding it difficult to make deliveries because of the logistics of getting foreign pilots to France or Germany and the reluctance of many airlines to take aircraft as they face liquidity problems, industry sources said. Even such details as finding hotels are said to be a problem, forcing Airbus to look at using its own hotel and restaurant in its in-house academy known as Airbus University. Unions and some analysts have expressed surprise that it has not shut factories completely given the difficulty of making deliveries. The company has said it is taking every possible step to keep its people healthy and is not forcing anybody to work. Additional reporting by Allison Lampert in Montreal; editing by Barbara LewisOur Standards:The Thomson Reuters Trust Principles.0 : 0narrow-browser-and-phonemedium-browser-and-portrait-tabletlandscape-tabletmedium-wide-browserwide-browser-and-largermedium-browser-and-landscape-tabletmedium-wide-browser-and-largerabove-phoneportrait-tablet-and-aboveabove-portrait-tabletlandscape-tablet-and-abovelandscape-tablet-and-medium-wide-browserportrait-tablet-and-belowlandscape-tablet-and-belowAppsNewslettersAdvertise with UsAdvertising GuidelinesCookiesTerms of UsePrivacyDo Not Sell My Personal InformationAll quotes delayed a minimum of 15 minutes. See here for a complete list of exchanges and delays.© 2020 Reuters. All Rights Reserved.",28,21.230986448129713
"June 22, 2020",CGC,"                Nokia to cut a third of jobs at French arm Alcatel-Lucent - ReutersDiscover Thomson ReutersFinancialGovernment SolutionsLegalReuters News AgencyRisk Management SolutionsTax & AccountingBlog: Answers OnInnovation @ Thomson ReutersDirectory of sitesLoginContactSupportBusinessMarketsWorldPoliticsTVMoreUnited States Technology NewsJune 22, 2020 /  9:20 AM / a month agoNokia to cut a third of jobs at French arm Alcatel-LucentMathieu Rosemain, Gwénaëlle Barzic3 Min ReadPARIS (Reuters) - Finnish telecoms equipment maker Nokia Oyj (NOKIA.HE) plans to cut 1,233 jobs at its French subsidiary Alcatel-Lucent International, equivalent to a third of the unit’s workforce, the group said on Monday, confirming an earlier Reuters report. FILE PHOTO: Visitors gather outside the Nokia booth at the Mobile World Congress in Barcelona, Spain, February 26, 2019. REUTERS/Sergio Perez/File PhotoThe announcement, just as Europe prepares for the deployment of the next generation of mobile internet, or 5G, has political resonance in France because Nokia bought the unit five years ago on condition it would keep jobs. Nokia, which competes with Ericsson (ERICb.ST) and Huawei [HWT.UL] for 5G networks, said in a statement the staff reduction was needed because of significant cost pressures. Nokia said in April it aimed to cut costs by 500 million euros ($560.30 million) by the end of this year compared with full-year 2018, with 350 million euros targeted to come from operating expenses and 150 million from sales costs.  When Nokia bought Alcatel-Lucent International, it pledged to preserve jobs in France for two years and to expand research and development teams in the country to create a resource within the group for 5G technology. The French research and development teams are particularly affected by the job cuts. “Nokia must improve this job cuts plan really significantly,” an official at the French finance ministry official said on condition of anonymity. Nokia became free from the commitments it made this month, a spokeswoman said, while the company’s president in France said Nokia would still be a big source of jobs. “Nokia will continue to be a major employer in France with a strong foothold in R&D, sales and services, which will enable us to develop and execute our customers’ projects efficiently,” Thierry Boisnon, president of Nokia in France, said in written comments.     Nokia employs 5,138 people in France, of which 3,640 work for Alcatel-Lucent International.  Related CoverageNokia must 'really significantly' reduce job cuts in France, finance ministry official saysThe entity was part of the Alcatel-Lucent group before  Nokia bought it in 2015 in an all-share deal that valued the French business at 15.6 billion euros. The merger was scrutinised by the French government and its then economy minister Emmanuel Macron, who is now president. “It’s just a low-cost strategy that is being implemented, contrary to all the commitments made by Nokia in France. Nokia is laughing at everyone, first and foremost the French government,” the CFE-CGC union at Nokia said on its website. Reporting by Mathieu Rosemain and Gwenalle Barzic; additional reporting by Anne Kauranen in Helsinki; editing by Richard Lough, Mark Potter and Barbara LewisOur Standards:The Thomson Reuters Trust Principles.0 : 0narrow-browser-and-phonemedium-browser-and-portrait-tabletlandscape-tabletmedium-wide-browserwide-browser-and-largermedium-browser-and-landscape-tabletmedium-wide-browser-and-largerabove-phoneportrait-tablet-and-aboveabove-portrait-tabletlandscape-tablet-and-abovelandscape-tablet-and-medium-wide-browserportrait-tablet-and-belowlandscape-tablet-and-belowAppsNewslettersAdvertise with UsAdvertising GuidelinesCookiesTerms of UsePrivacyDo Not Sell My Personal InformationAll quotes delayed a minimum of 15 minutes. See here for a complete list of exchanges and delays.© 2020 Reuters. All Rights Reserved.",23,4.490493618947339
"June 30, 2020",CGC,"                Airbus to cut 15,000 jobs to survive coronavirus crisis - ReutersDiscover Thomson ReutersFinancialGovernment SolutionsLegalReuters News AgencyRisk Management SolutionsTax & AccountingBlog: Answers OnInnovation @ Thomson ReutersDirectory of sitesLoginContactSupportBusinessMarketsWorldPoliticsTVMoreUnited States Business NewsJune 30, 2020 /  8:31 AM / 21 days agoAirbus to cut 15,000 jobs to survive coronavirus crisisJulie Rimbert, Johanna Decorse, Tim Hepher4 Min ReadTOULOUSE, France/PARIS (Reuters) - Airbus is cutting 15,000 jobs within a year, including 900 already earmarked in Germany, saying its future is at stake after the coronavirus outbreak paralysed air travel. The logo of Airbus is pictured at the entrance of the Airbus facility in Bouguenais, near Nantes, France, June 30, 2020. REUTERS/Stephane MaheAirbus is moving swiftly to counter damage caused by a 40% slump in its 55-billion-euro ($61.8 billion) jet business following the pandemic, balancing belt-tightening against aid offered by European governments and future priorities. But it faces tough talks with governments as well as unions, which immediately pledged to fight compulsory redundancies. A 2008 restructuring triggered rare strikes and protests. “It’s going to be a mighty battle to save jobs,” said Francoise Vallin of the CFE-CGC union. Europe’s biggest aerospace group said it would cut 5,000 posts in France, 5,100 in Germany, 900 in Spain, 1,700 in the UK, and 1,300 elsewhere by mid-2021, for a core total of 14,000.  The broader tally includes another 900 job cuts planned  before the crisis at its Premium AEROTEC unit in Germany. On June 3, Reuters reported reduced jet output pointed to cuts of 14,000 full-time posts. Earlier on Tuesday, French union sources predicted 15,000 cuts in total. Britain’s Unite union called the measures “industrial vandalism.” France’s hard-left Force Ouvriere union and others said they would oppose mandatory cuts. There was immediate political pushback in France, where the government of President Emmanuel Macron this month announced a 15-billion-euro support package for aviation. “The number of job cuts announced by Airbus is excessive. We expect Airbus to fully use instruments put in place by the government to reduce job cuts,” a finance ministry source said. Related CoverageAirbus CEO warns staff against national rivalries amid job cutsAirbus plans to cut jobs right across its UK operation: unionSee more stories Airbus refused to exclude sackings, but said it would first seek voluntary departures, early retirements and other measures. It wants to start implementing cuts this autumn and complete them next summer - a brisk deadline for such plans in Europe. Chief Executive Guillaume Faury said the company had been left with no choice by the dire industry crisis. “It is the reality we have to face and we are trying to give a long-term perspective to Airbus,” he told reporters. PRODUCTION OUTLOOK Airbus said in April it was reducing output by a third, but has raised that to 40% as it presses the case for job cuts. Sources say the discrepancy reflects different ways of measuring output on a weighted basis, rather than an immediate new cut. “We think we are rather stable now and there will be minor adjustments as we have in normal times,” Faury told Reuters.  But he added, “minor changes can be bigger than seen in past because there is more volatility in the market.” Exceptional secrecy had surrounded the politically sensitive restructuring affecting jobs in Britain, France, Germany and Spain, the company’s key backers in a fierce contest with U.S. rival Boeing for orders and industrial clout. About 37% of the 135,000-strong Airbus workforce is due to retire this decade, led by veterans of its best-selling A320. Boeing is cutting over 12,000 U.S. jobs, including 6,770 involuntary layoffs, after the pandemic compounded woes caused by the 15-month-old grounding of its 737 MAX. FILE PHOTO: The logo of Airbus is pictured at the entrance of the Airbus facility in Bouguenais, near Nantes, France April 27, 2020. REUTERS/Stephane Mahe/File PhotoAirbus’ programmes chief said it was slowing a push into after-sales services while maintaining a strategy of diversifying into the high-margin area. Some industry sources say Airbus has all but abandoned a goal of more than doubling services revenue to $10 billion this decade and transferred some staff to other roles. Reporting by Julie Rimbert, Johanna Decorse and Tim Hepher; Additional reporting by Eric M. Johnson in Seattle, Alistair Smout in London; Writing by Tim Hepher in France; Editing by Richard Lough, Mark Potter and Leslie AdlerOur Standards:The Thomson Reuters Trust Principles.0 : 0narrow-browser-and-phonemedium-browser-and-portrait-tabletlandscape-tabletmedium-wide-browserwide-browser-and-largermedium-browser-and-landscape-tabletmedium-wide-browser-and-largerabove-phoneportrait-tablet-and-aboveabove-portrait-tabletlandscape-tablet-and-abovelandscape-tablet-and-medium-wide-browserportrait-tablet-and-belowlandscape-tablet-and-belowAppsNewslettersAdvertise with UsAdvertising GuidelinesCookiesTerms of UsePrivacyDo Not Sell My Personal InformationAll quotes delayed a minimum of 15 minutes. See here for a complete list of exchanges and delays.© 2020 Reuters. All Rights Reserved.",15,12.31435513557165
