date,ticker,content,time_delta,pct_change
"December 5, 2019",etsy,"                REFILE-US STOCKS-Wall Street bides its time, awaiting news from trade front - ReutersDiscover Thomson ReutersFinancialGovernment SolutionsLegalReuters News AgencyRisk Management SolutionsTax & AccountingBlog: Answers OnInnovation @ Thomson ReutersDirectory of sitesLoginContactSupportBusinessMarketsWorldPoliticsTVMoreUnited States Market NewsDecember 5, 2019 /  7:37 PM / 8 months agoREFILE-US STOCKS-Wall Street bides its time, awaiting news from trade frontStephen Culp4 Min Read(Fixes typo in first sentence.) * Nike rises on Goldman Sachs upgrade * Kroger drops following earnings miss * Sage sinks as depression drug fails trial * Indexes: Dow up 0.03%, S&P 500 up 0.05%, Nasdaq off 0.03% By Stephen Culp NEW YORK, Dec 5 (Reuters) - Wall Street was largely unchanged on Thursday as market participants stayed on the sidelines, awaiting further developments in the hoped-for interim trade deal between the United States and China. The S&P 500 and the Dow were slightly higher and the Nasdaq nominally lower, their losses held in check by a rise in tech stocks. Markets have been whipsawed in recent days as conflicting reports on whether the world’s two largest economies would be able to arrive at a “phase one” agreement prior to Dec. 15, when a new round of tariffs on Chinese imports is scheduled to take effect. “We’re on hold until we see what happens on the trade front,” said Chuck Carlson, chief executive officer at Horizon Investment Services in Hammond, Indiana. “People are trying to get a read on what’s going to happen with the trade talks and the next relevant deadline is Dec 15.” Market participants appeared to show little heed to the drama unfolding in Washington as the U.S. House of Representatives prepared to draft articles of impeachment against President Donald Trump. “What impacts investor psychology is uncertainty, and I don’t think there’s any uncertainty as to how (the impeachment proceedings) will play out,” Carlson added. “At the end of the day, whether there’s an impeachment or not isn’t going to stop a money manager from deciding whether or not he’ll by Intel.” The articles of impeachment stem from a July 25 phone call in which Trump asked Ukrainian President Volodymyr Zelenskiy to carry out two investigations that would benefit him politically. The Dow Jones Industrial Average rose 17.89 points, or 0.06%, to 27,667.67, the S&P 500 gained 2.02 points, or 0.06%, to 3,114.78 and the Nasdaq Composite dropped 0.35 points, or -0%, to 8,566.32. Of the 11 major sectors in the S&P 500 seven were trading in the red. Materials stocks were the biggest winners, while consumer staples suffered the largest percentage drop. Nike Inc gained 1.8% following Goldman Sachs’ upgrade of the sportswear maker’s stock to “buy” from “neutral.” Kroger Co shares fell 3.5% after the supermarket chain missed Wall Street earnings estimates, hurt by stiff competition from Walmart Inc and Amazon.com Inc . Online craft retailer Etsy dipped 2.7% on the heels of a downgrade to “underweight” by Morgan Stanley. SecureWorks Corp jumped 22.8%, on course for its best day ever, after the cyber security firm posted a surprise third-quarter profit. Sage Therapeutics Inc tumbled 59.1% after its depression drug failed in a late-stage study. On the economic front, a shrinking trade deficit, a drop in jobless claims and a rebound in factory orders suggested a still-robust, if slowing, U.S. economy. Investors now look to Friday’s employment report from the U.S. Labor Department, which is expected to show an increase of 180,000 nonfarm payrolls in November. Advancing issues outnumbered declining ones on the NYSE by a 1.02-to-1 ratio; on Nasdaq, a 1.02-to-1 ratio favored advancers. The S&P 500 posted 11 new 52-week highs and 3 new lows; the Nasdaq Composite recorded 46 new highs and 53 new lows. (Reporting by Stephen Culp in New York Editing by Matthew Lewis)Our Standards:The Thomson Reuters Trust Principles.0 : 0narrow-browser-and-phonemedium-browser-and-portrait-tabletlandscape-tabletmedium-wide-browserwide-browser-and-largermedium-browser-and-landscape-tabletmedium-wide-browser-and-largerabove-phoneportrait-tablet-and-aboveabove-portrait-tabletlandscape-tablet-and-abovelandscape-tablet-and-medium-wide-browserportrait-tablet-and-belowlandscape-tablet-and-belowAppsNewslettersAdvertise with UsAdvertising GuidelinesCookiesTerms of UsePrivacyDo Not Sell My Personal InformationAll quotes delayed a minimum of 15 minutes. See here for a complete list of exchanges and delays.© 2020 Reuters. All Rights Reserved.",21,10.567324530890689
"December 5, 2019",etsy,"                US STOCKS-Wall Street inches higher as Dec. 15 tariff deadline looms - ReutersDiscover Thomson ReutersFinancialGovernment SolutionsLegalReuters News AgencyRisk Management SolutionsTax & AccountingBlog: Answers OnInnovation @ Thomson ReutersDirectory of sitesLoginContactSupportBusinessMarketsWorldPoliticsTVMoreUnited States Market NewsDecember 5, 2019 /  9:17 PM / 8 months agoUS STOCKS-Wall Street inches higher as Dec. 15 tariff deadline loomsStephen Culp4 Min Read(For a live blog on the U.S. stock market, click or type LIVE/ in a news window.) * Nike rises on Goldman Sachs upgrade * Kroger drops following earnings miss * Sage sinks as depression drug fails trial * Indexes up: Dow up 0.1%, S&P 500 up 0.15%, Nasdaq 0.05% (Updates to market close) By Stephen Culp NEW YORK, Dec 5 (Reuters) - Wall Street eked out slight gains on Thursday as investors waited for concrete news on a hoped-for interim trade deal between the United States and China before a new round of tariffs scheduled to kick in on Dec. 15. Tech stocks led all three major U.S. stock averages marginally into the black following upbeat statements from President Donald Trump and Treasury Secretary Steven Mnuchin that the U.S.-China trade negotiations are “on track” and “going well.” Markets have been whipsawed in recent days by conflicting reports on whether the world’s two largest economies would be able to arrive at a “phase one” agreement prior to Dec. 15, when a new round of tariffs on Chinese imports is expected to take effect. “Investors are trying to calibrate things,” said Matthew Keator, managing partner in the Keator Group, a wealth management firm in Lenox, Massachusetts. “The markets are going to toggle up and down until we see what happens on Dec. 15th to get some sort of clarity in terms of how to move forward in the near term.” Market participants appeared to shrug off the drama unfolding in Washington as the U.S. House of Representatives prepared to draft articles of impeachment against President Donald Trump. “The market has become desensitized a bit to the partisanship that’s been going on,” said Keator, while adding that “uncertainty is not something the market enjoys.” The Dow Jones Industrial Average rose 28.01 points, or 0.1%, to 27,677.79, the S&P 500 gained 4.67 points, or 0.15%, to 3,117.43 and the Nasdaq Composite added 4.03 points, or 0.05%, to 8,570.70. Of the 11 major sectors in the S&P 500, eight closed higher. Materials stocks were the biggest winners, while energy suffered the largest percentage drop. Nike Inc gained 2.2% following Goldman Sachs’ upgrade of the sportswear maker’s stock to “buy” from “neutral.” Kroger Co shares fell 3.0% after the supermarket chain missed Wall Street earnings estimates, hurt by stiff competition from Walmart Inc and Amazon.com Inc . Online craft retailer Etsy dipped 2.5% on a downgrade to “underweight” by Morgan Stanley. SecureWorks Corp jumped 29.4%, its best day ever, after the cyber security firm posted a surprise third-quarter profit. Sage Therapeutics Inc tumbled 59.7% after its depression drug failed in a late-stage study. Economic data showed a shrinking trade deficit, a drop in jobless claims and a rebound in factory orders, suggesting a still-robust, if slowing, U.S. economy. Investors now look to Friday’s employment report from the U.S. Labor Department, which is expected to show nonfarm payrolls increased by 180,000 in November. Advancing issues outnumbered declining ones on the NYSE by a 1.15-to-1 ratio; on Nasdaq, a 1.00-to-1 ratio favored decliners. The S&P 500 posted 14 new 52-week highs and 3 new lows; the Nasdaq Composite recorded 54 new highs and 64 new lows. Volume on U.S. exchanges was 6.42 billion shares, compared with the 6.71 billion average over the last 20 trading days. (Reporting by Stephen Culp in New York; Editing by Dan Grebler)Our Standards:The Thomson Reuters Trust Principles.0 : 0narrow-browser-and-phonemedium-browser-and-portrait-tabletlandscape-tabletmedium-wide-browserwide-browser-and-largermedium-browser-and-landscape-tabletmedium-wide-browser-and-largerabove-phoneportrait-tablet-and-aboveabove-portrait-tabletlandscape-tablet-and-abovelandscape-tablet-and-medium-wide-browserportrait-tablet-and-belowlandscape-tablet-and-belowAppsNewslettersAdvertise with UsAdvertising GuidelinesCookiesTerms of UsePrivacyDo Not Sell My Personal InformationAll quotes delayed a minimum of 15 minutes. See here for a complete list of exchanges and delays.© 2020 Reuters. All Rights Reserved.",21,10.567324530890689
"March 8, 2019",etsy,"                BUZZ-U.S. STOCKS ON THE MOVE-Eventbrite, banks, oil stocks, Big Lots, Exxon Mobil, DropCar - ReutersDiscover Thomson ReutersFinancialGovernment SolutionsLegalReuters News AgencyRisk Management SolutionsTax & AccountingBlog: Answers OnInnovation @ Thomson ReutersDirectory of sitesLoginContactSupportBusinessMarketsWorldPoliticsTVMoreUnited States Hot StocksMarch 8, 2019 /  4:59 PM / a year agoBUZZ-U.S. STOCKS ON THE MOVE-Eventbrite, banks, oil stocks, Big Lots, Exxon Mobil, DropCar7 Min Read    * Eikon search string for individual stock moves:            * The Day Ahead newsletter: tmsnrt.rs/2ggOmBi    * The Morning News Call newsletter: tmsnrt.rs/2fwPLThWall Street's main indexes fell on Friday, after data showed U.S. job growthalmost stalled in February, adding to concerns of a slowdown in global growthsparked by weak China export data and a prolonged slowdown in the eurozone.    At 11:42 ET, the Dow Jones Industrial Average was down 0.45 percentat 25,358.99. The S&P 500 was down 0.59 percent at 2,732.77 and theNasdaq Composite was down 0.52 percent at 7,382.582.  The top three S&P 500 percentage gainers: ** Costco Wholesale Corp, up 4.9 pct ** General Electric Co, up 1.5 pct ** Henry Schein, up 1.5 pct  The top three S&P 500 percentage losers: ** Noble Energy, down 4.8 pct ** Cimarex Energy, down 4.3 pct ** Apache Corp, down 4.3 pct  The top three NYSE percentage gainers:  ** Big Lots Inc, up 15.1 pct ** 22nd Century Group Inc, up 14.5 pct ** Red Lion Hotel, up 11.8 pct   The top three NYSE percentage losers: ** Eventbrite Inc, down 25.5 pct ** Sanchez Midstream Partners LP, down 18.1 pct ** Orion Engineered Carbons SA, down 17.8 pct  The top three Nasdaq percentage gainers: ** Trovagene Inc, up 81.8 pct ** Futu Holdings Ltd, up 42.9 pct ** Seelos Therapeutics Inc, up 37.5 pct   The top three Nasdaq percentage losers: ** CHF Solutions, down 43.9 pct ** Biopath Holdings, down 33.6 pct ** Altimmune Inc, down 32.8 pct    ** Noble Energy: down 4.8 pct  ** Diamondback Energy: down 2.3 pct  ** Apache Corp: down 4.3 pct  ** Exxon Mobil Corp: down 1.6 pct  ** Chevron Corp: down 1.3 pct BUZZ-Oil stocks fall as weak economic outlook weighs on crude prices   ** Vail Resorts Inc: up 8.8 pct BUZZ-Rises after profit beat   ** VF Corp: down 1.5 pct ** PVH Corp: down 0.4 pct ** L Brands: down 2.4 pct ** Gap Inc: down 2.1 pct ** Kohl's Corp: down 2.1 pct ** Macy's Inc: down 1.4 pct ** Nordstrom Inc: down 0.8 pct ** TJX Cos Inc: down 1.7 pct ** Ross Stores Inc: down 2.6 pct ** Home Depot Inc: down 1.2 pct ** Lowe's Companies Inc: down 1.5 pct BUZZ-Consumer discretionary stocks drop on weak job data  ** T2 Biosystems: down 20.6 pct BUZZ-Falls on ""soft"" Q1 forecast, Q4 revenue miss  ** Marvell Technologies: down 3.2 pct BUZZ-Q1 is bottom, 5G to drive long term growth   ** Facebook Inc: down 0.4 pct ** Amazon.com Inc: down 1.0 pct ** Alphabet Inc: down 0.1 pct BUZZ-Shares of Facebook, Amazon, Google pare on Senator Warren's calls forregulations   ** Stellar Biotech: up 62.5 pct BUZZ-Enters into merger deal with Edesa, shares skyrocket  ** HTG Molecular: down 12.3 pct BUZZ-Falls after weak 2019 rev forecast  ** Syndax Pharmaceuticals: down 5.7 pct BUZZ-Lead drug fails two trials, shares fall  ** Citigroup: down 0.3 pct ** Morgan Stanley: up 0.1 pct ** Goldman Sachs: up 0.8 pct ** Bank of America: down 0.5 pct ** JPMorgan Chase & Co: down 0.3 pct BUZZ-U.S. Banks fall after weak job data, lower treasury yields  ** Netflix Inc: down 1.6 pct BUZZ-Down after Buckingham Research downgrades to 'neutral'  ** Ferrellgas Partners LP: down 21.4 pct BUZZ-Falls on lower-than-expected Q2 results  ** Etsy Inc: up 0.8 pct BUZZ-Drops as BTIG cuts to ""neutral"" as stock hits PT  ** MercadoLibre: down 0.9 pct BUZZ-Susquehanna cuts to ""negative"" on competition worries  ** Metlife Inc: down 0.9 pct ** Prudential Financial Inc: down 1.1 pct BUZZ-U.S. insurers fall as treasury yields get hit by weak job data  ** Alaska Air Group Inc: down 0.2 pct BUZZ-Imperial Capital downgrades to 'in-line'  ** Tilray Inc: down 2.1 pct BUZZ-Jefferies says valuation 'too rich'  ** Eventbrite Inc: down 25.5 pct BUZZ- JP Morgan says Ticketfly phase out to weigh beyond Q1  ** Costco Wholesale Corp: up 4.9 pct BUZZ-JPM sees special dividend potential  ** Exxon Mobil: down 1.6 pct BUZZ-Cowen sees lower dividend growth, downgrades to ""market perform""     ** Myomo Inc: up 8.3 pct BUZZ-Powers up on strong Q4 sales, smaller loss  ** Tandem Diabetes Care Inc: up 3.4 pct BUZZ-Tandem Diabetes' 2018 recovery is only the first chapter - BMO  ** Navistar International: down 4.0 pct BUZZ-Up after higher-than-expected results ** Horizon Pharma Plc: up 3.4 pct BUZZ-Gains after MS upgrades to 'overweight' after sell-off  ** GameStop Corp: down 6.6 pct BUZZ-Shares slide on BofA downgrade  ** SAExploration:: up 14.1 pct BUZZ-Soars more than 50 pct on new project wins  ** National Beverage Corp: down 18.1 pct BUZZ-Loses fizz on rating downgrade, PT cut  ** Okta Inc: down 4.7 pct BUZZ-Falls on weak Q1, FY 2019 forecast  ** Upland Software Inc: up 15.9 pct BUZZ-Poised for 5-month high following multiple PT hikes  ** Big Lots Inc: up 15.1 pct BUZZ- Surges 10 pct after holiday boost to results  ** Caesars Entertainment Corp: down 1.8 pct BUZZ-Shares up after Icahn raises stake     ** Tonix Pharmaceuticals Holdings Corp: up 34.1 pct BUZZ-Soars as new PTSD drug wins European patent  ** DropCar Inc: down 3.8 pct BUZZ-Zooms as company mulls strategic options  ** Seelos Therapeutics: up 37.5 pct BUZZ-Going for 2nd day of gains on Parkinson's drug license  ** Micron Technology: up 0.6 pct BUZZ-PiperJaffray says things could get worse from here  ** Navistar International: down 4.0 pct BUZZ-Up after higher-than-expected results ** Alkaline Water: down 16.3 pct BUZZ-Spills on deep-discounted $10 mln stock deal  ** AMAG Pharmaceuticals Inc: down 21.4 pct BUZZ-Falls after approved drug for pregnant women fails trial          The 11 major S&P 500 sectors:  Communication Services             down 0.37 pct Consumer Discretionary             down 0.98 pct Consumer Staples                   down 0.03 pct Energy                             down 2.14 pct Financial                          down 0.41 pct Health                             down 0.58 pct Industrial                         down 0.65 pct Information Technology             down 0.54 pct Materials                          down 0.36 pct Real Estate                        down 0.14 pct Utilities                          down 0.16 pct  (Compiled by Vibhuti Sharma in Bengaluru)  Our Standards:The Thomson Reuters Trust Principles.0 : 0narrow-browser-and-phonemedium-browser-and-portrait-tabletlandscape-tabletmedium-wide-browserwide-browser-and-largermedium-browser-and-landscape-tabletmedium-wide-browser-and-largerabove-phoneportrait-tablet-and-aboveabove-portrait-tabletlandscape-tablet-and-abovelandscape-tablet-and-medium-wide-browserportrait-tablet-and-belowlandscape-tablet-and-belowAppsNewslettersAdvertise with UsAdvertising GuidelinesCookiesTerms of UsePrivacyDo Not Sell My Personal InformationAll quotes delayed a minimum of 15 minutes. See here for a complete list of exchanges and delays.© 2020 Reuters. All Rights Reserved.",4,4.987465029125556
"April 2, 2019",etsy,"                Blue Apron CEO Brad Dickerson to resign - ReutersDiscover Thomson ReutersFinancialGovernment SolutionsLegalReuters News AgencyRisk Management SolutionsTax & AccountingBlog: Answers OnInnovation @ Thomson ReutersDirectory of sitesLoginContactSupportBusinessMarketsWorldPoliticsTVMoreUnited States Company NewsApril 2, 2019 /  8:36 PM / a year agoBlue Apron CEO Brad Dickerson to resign1 Min ReadApril 2 (Reuters) - Meal-kit service provider Blue Apron Holdings Inc said on Tuesday its chief executive officer, Brad Dickerson, would resign to pursue other opportunities. The company said Etsy Inc’s former Chief Operating Officer Linda Findley Kozlowski would become the CEO, effective April 8. Blue Apron also said its co-founder Ilia Papas would be leaving the company to pursue other opportunities. (Reporting by Soundarya J in Bengaluru; Editing by James Emmanuel)Our Standards:The Thomson Reuters Trust Principles.0 : 0narrow-browser-and-phonemedium-browser-and-portrait-tabletlandscape-tabletmedium-wide-browserwide-browser-and-largermedium-browser-and-landscape-tabletmedium-wide-browser-and-largerabove-phoneportrait-tablet-and-aboveabove-portrait-tabletlandscape-tablet-and-abovelandscape-tablet-and-medium-wide-browserportrait-tablet-and-belowlandscape-tablet-and-belowAppsNewslettersAdvertise with UsAdvertising GuidelinesCookiesTerms of UsePrivacyDo Not Sell My Personal InformationAll quotes delayed a minimum of 15 minutes. See here for a complete list of exchanges and delays.© 2020 Reuters. All Rights Reserved.",1,-0.38721391002785555
"October 3, 2019",etsy,"                BlackRock program to test tools to boost saving by individuals - ReutersDiscover Thomson ReutersFinancialGovernment SolutionsLegalReuters News AgencyRisk Management SolutionsTax & AccountingBlog: Answers OnInnovation @ Thomson ReutersDirectory of sitesLoginContactSupportBusinessMarketsWorldPoliticsTVMoreUnited States Business NewsOctober 3, 2019 /  1:10 PM / 10 months agoBlackRock program to test tools to boost saving by individualsSaqib Iqbal Ahmed2 Min ReadFILE PHOTO: The company logo and trading information for BlackRock is displayed on a screen on the floor of the New York Stock Exchange (NYSE) in New York, U.S., March 30, 2017. REUTERS/Brendan McDermidNEW YORK (Reuters) - BlackRock Inc (BLK.N) has teamed up with Mastercard Inc (MA.N), United Parcel Service Inc (UPS.N) and Etsy Inc (ETSY.O) among other organizations, to build and test tools to help individuals start saving for emergencies. The companies will work with a group of nonprofits focused on consumer financial health to build then test savings products on their employees, BlackRock said in a statement. The program will be funded by BlackRock’s previously announced $50 million commitment to its emergency savings initiative, the asset manager said. A number of companies have in recent years taken steps to encourage employees to fund emergency accounts as they respond to data that suggests a large percentage of American households are ill-prepared to deal with a financial emergency. A recent Federal Reserve report on the economic wellbeing of American households found that about 40% of Americans would struggle to cover an unexpected $400 expense. Reporting by Saqib Iqbal Ahmed; Editing by Cynthia OstermanOur Standards:The Thomson Reuters Trust Principles.0 : 0narrow-browser-and-phonemedium-browser-and-portrait-tabletlandscape-tabletmedium-wide-browserwide-browser-and-largermedium-browser-and-landscape-tabletmedium-wide-browser-and-largerabove-phoneportrait-tablet-and-aboveabove-portrait-tabletlandscape-tablet-and-abovelandscape-tablet-and-medium-wide-browserportrait-tablet-and-belowlandscape-tablet-and-belowAppsNewslettersAdvertise with UsAdvertising GuidelinesCookiesTerms of UsePrivacyDo Not Sell My Personal InformationAll quotes delayed a minimum of 15 minutes. See here for a complete list of exchanges and delays.© 2020 Reuters. All Rights Reserved.",14,8.2407712276423
